comment,author,num_likes,rate
암세포도 암걸리는 영화,최승건,600,1.3101540803909302
다세포 소녀 하셨나요? 않 하셨으면 해주세요,라라남매,22,2.733764410018921
구불님도 드디어 내공이 쌓이셔서 전설적인 작품까지 리뷰하시는군요.,이불사랑,20,9.088865280151367
9bul님  영화 추천 합니다  미스터 빈의 홀리데이  영화추천 해요!,야니네누군지아뉘,34,6.479876518249512
ㅋㅋㅋㅋㅋㅋㅋㅋㅋㅋㅋㅋ,Son Ja,3,3.4617645740509033
드디어 올것이 왔군요 잘보겠습니다 ㅋㅋㅋㅋ,JK Li,5,7.039760112762451
구불... 신의 영역의 영화에 도전하다 박수....,denny1066,7,6.841588020324707
드디어 클레멘타인 나왔다ㅋㅋㅋ 얼마나 재밌으려나 기대기대&gt;&lt;,Haena해나,13,2.338620901107788
내가졌다..! 클레멘타인. 너의 승리다..,9bul,2150,0.8506121635437012
